name,content
A299,"To localize the global, innovate locally leveraging global standards that enable interoperability, portability, and reusability, and adapt global products to integrate into local context"
A300,"To migrate the local, develop a replicable formula to repeat what worked in one local in many others; identify dimensions describing a local and what locals can be easily migrated; attract customers to invest in the development of localized offers; and engage the right local people"
A301,"To disseminate the global, increase communications with global agents, and learn from global agents how to improve the global offer "
A302,Innovate in scalable niche markets that are underserved
A306,Focus on company differentiators and build upon complementary products that satisfy company needs and are not part of the company competencies
A307,Simplify the complementarity of the company products and services
A310,Ensure offers are scalable and meet rigorous reliability metrics
A311,Provide platforms that are client centric and highly customizable
A317,"Operate a platform that is simple to use, attracts a very large market, and enables the company to control the quality of the offers traded on the platform"
A320,Use data obtained from third-party platforms to adjust your company's offers
A321,Enable partners to leverage your company's platform to make money 
